
*** Running vivado
    with args -log display_decoder_segment_d_0_0.vds -m64 -product Vivado -mode batch -messageDb vivado.pb -notrace -source display_decoder_segment_d_0_0.tcl


****** Vivado v2019.2 (64-bit)
  **** SW Build 2708876 on Wed Nov  6 21:40:23 MST 2019
  **** IP Build 2700528 on Thu Nov  7 00:09:20 MST 2019
    ** Copyright 1986-2019 Xilinx, Inc. All Rights Reserved.

source display_decoder_segment_d_0_0.tcl -notrace
INFO: [IP_Flow 19-234] Refreshing IP repositories
INFO: [IP_Flow 19-1700] Loaded user IP repository 'c:/Users/stefa/iCloudDrive/ASU/Spring 2020/CSE_320/Labs_New/CSE320_Lab2/XUP_LIB'.
INFO: [IP_Flow 19-2313] Loaded Vivado IP repository 'C:/Xilinx/Vivado/2019.2/data/ip'.
Command: synth_design -top display_decoder_segment_d_0_0 -part xc7a100tcsg324-1 -mode out_of_context
Starting synth_design
Attempting to get a license for feature 'Synthesis' and/or device 'xc7a100t'
INFO: [Common 17-349] Got license for feature 'Synthesis' and/or device 'xc7a100t'
INFO: [Device 21-403] Loading part xc7a100tcsg324-1
INFO: Launching helper process for spawning children vivado processes
INFO: Helper process launched with PID 5324 
---------------------------------------------------------------------------------
Starting RTL Elaboration : Time (s): cpu = 00:00:04 ; elapsed = 00:00:04 . Memory (MB): peak = 977.621 ; gain = 234.328
---------------------------------------------------------------------------------
INFO: [Synth 8-6157] synthesizing module 'display_decoder_segment_d_0_0' [c:/Users/stefa/iCloudDrive/ASU/Spring 2020/CSE_320/Labs_New/CSE320_Lab2/CSE320_Lab2.srcs/sources_1/bd/display_decoder/ip/display_decoder_segment_d_0_0/synth/display_decoder_segment_d_0_0.v:58]
INFO: [Synth 8-6157] synthesizing module 'segment_d' [c:/Users/stefa/iCloudDrive/ASU/Spring 2020/CSE_320/Labs_New/CSE320_Lab2/CSE320_Lab2.srcs/sources_1/bd/display_decoder/ipshared/4437/src/segment_d.v:13]
INFO: [Synth 8-6157] synthesizing module 'segment_d_xup_and3_0_0' [c:/Users/stefa/iCloudDrive/ASU/Spring 2020/CSE_320/Labs_New/CSE320_Lab2/CSE320_Lab2.srcs/sources_1/bd/display_decoder/ip/display_decoder_segment_d_0_0/src/segment_d_xup_and3_0_0/synth/segment_d_xup_and3_0_0.v:57]
INFO: [Synth 8-6157] synthesizing module 'xup_and3' [c:/Users/stefa/iCloudDrive/ASU/Spring 2020/CSE_320/Labs_New/CSE320_Lab2/CSE320_Lab2.srcs/sources_1/bd/display_decoder/ip/display_decoder_segment_d_0_0/ipshared/b79c/xup_and3.srcs/sources_1/new/xup_and3.v:5]
	Parameter DELAY bound to: 3 - type: integer 
INFO: [Synth 8-6155] done synthesizing module 'xup_and3' (1#1) [c:/Users/stefa/iCloudDrive/ASU/Spring 2020/CSE_320/Labs_New/CSE320_Lab2/CSE320_Lab2.srcs/sources_1/bd/display_decoder/ip/display_decoder_segment_d_0_0/ipshared/b79c/xup_and3.srcs/sources_1/new/xup_and3.v:5]
INFO: [Synth 8-6155] done synthesizing module 'segment_d_xup_and3_0_0' (2#1) [c:/Users/stefa/iCloudDrive/ASU/Spring 2020/CSE_320/Labs_New/CSE320_Lab2/CSE320_Lab2.srcs/sources_1/bd/display_decoder/ip/display_decoder_segment_d_0_0/src/segment_d_xup_and3_0_0/synth/segment_d_xup_and3_0_0.v:57]
INFO: [Synth 8-6157] synthesizing module 'segment_d_xup_and3_0_1' [c:/Users/stefa/iCloudDrive/ASU/Spring 2020/CSE_320/Labs_New/CSE320_Lab2/CSE320_Lab2.srcs/sources_1/bd/display_decoder/ip/display_decoder_segment_d_0_0/src/segment_d_xup_and3_0_1/synth/segment_d_xup_and3_0_1.v:57]
INFO: [Synth 8-6155] done synthesizing module 'segment_d_xup_and3_0_1' (3#1) [c:/Users/stefa/iCloudDrive/ASU/Spring 2020/CSE_320/Labs_New/CSE320_Lab2/CSE320_Lab2.srcs/sources_1/bd/display_decoder/ip/display_decoder_segment_d_0_0/src/segment_d_xup_and3_0_1/synth/segment_d_xup_and3_0_1.v:57]
INFO: [Synth 8-6157] synthesizing module 'segment_d_xup_and3_0_2' [c:/Users/stefa/iCloudDrive/ASU/Spring 2020/CSE_320/Labs_New/CSE320_Lab2/CSE320_Lab2.srcs/sources_1/bd/display_decoder/ip/display_decoder_segment_d_0_0/src/segment_d_xup_and3_0_2/synth/segment_d_xup_and3_0_2.v:57]
INFO: [Synth 8-6155] done synthesizing module 'segment_d_xup_and3_0_2' (4#1) [c:/Users/stefa/iCloudDrive/ASU/Spring 2020/CSE_320/Labs_New/CSE320_Lab2/CSE320_Lab2.srcs/sources_1/bd/display_decoder/ip/display_decoder_segment_d_0_0/src/segment_d_xup_and3_0_2/synth/segment_d_xup_and3_0_2.v:57]
INFO: [Synth 8-6157] synthesizing module 'segment_d_xup_inv_0_0' [c:/Users/stefa/iCloudDrive/ASU/Spring 2020/CSE_320/Labs_New/CSE320_Lab2/CSE320_Lab2.srcs/sources_1/bd/display_decoder/ip/display_decoder_segment_d_0_0/src/segment_d_xup_inv_0_0/synth/segment_d_xup_inv_0_0.v:57]
INFO: [Synth 8-6157] synthesizing module 'xup_inv' [c:/Users/stefa/iCloudDrive/ASU/Spring 2020/CSE_320/Labs_New/CSE320_Lab2/CSE320_Lab2.srcs/sources_1/bd/display_decoder/ip/display_decoder_segment_d_0_0/ipshared/e3e7/xup_inv.srcs/sources_1/new/xup_inv.v:5]
	Parameter DELAY bound to: 3 - type: integer 
INFO: [Synth 8-6155] done synthesizing module 'xup_inv' (5#1) [c:/Users/stefa/iCloudDrive/ASU/Spring 2020/CSE_320/Labs_New/CSE320_Lab2/CSE320_Lab2.srcs/sources_1/bd/display_decoder/ip/display_decoder_segment_d_0_0/ipshared/e3e7/xup_inv.srcs/sources_1/new/xup_inv.v:5]
INFO: [Synth 8-6155] done synthesizing module 'segment_d_xup_inv_0_0' (6#1) [c:/Users/stefa/iCloudDrive/ASU/Spring 2020/CSE_320/Labs_New/CSE320_Lab2/CSE320_Lab2.srcs/sources_1/bd/display_decoder/ip/display_decoder_segment_d_0_0/src/segment_d_xup_inv_0_0/synth/segment_d_xup_inv_0_0.v:57]
INFO: [Synth 8-6157] synthesizing module 'segment_d_xup_inv_0_1' [c:/Users/stefa/iCloudDrive/ASU/Spring 2020/CSE_320/Labs_New/CSE320_Lab2/CSE320_Lab2.srcs/sources_1/bd/display_decoder/ip/display_decoder_segment_d_0_0/src/segment_d_xup_inv_0_1/synth/segment_d_xup_inv_0_1.v:57]
INFO: [Synth 8-6155] done synthesizing module 'segment_d_xup_inv_0_1' (7#1) [c:/Users/stefa/iCloudDrive/ASU/Spring 2020/CSE_320/Labs_New/CSE320_Lab2/CSE320_Lab2.srcs/sources_1/bd/display_decoder/ip/display_decoder_segment_d_0_0/src/segment_d_xup_inv_0_1/synth/segment_d_xup_inv_0_1.v:57]
INFO: [Synth 8-6157] synthesizing module 'segment_d_xup_inv_0_2' [c:/Users/stefa/iCloudDrive/ASU/Spring 2020/CSE_320/Labs_New/CSE320_Lab2/CSE320_Lab2.srcs/sources_1/bd/display_decoder/ip/display_decoder_segment_d_0_0/src/segment_d_xup_inv_0_2/synth/segment_d_xup_inv_0_2.v:57]
INFO: [Synth 8-6155] done synthesizing module 'segment_d_xup_inv_0_2' (8#1) [c:/Users/stefa/iCloudDrive/ASU/Spring 2020/CSE_320/Labs_New/CSE320_Lab2/CSE320_Lab2.srcs/sources_1/bd/display_decoder/ip/display_decoder_segment_d_0_0/src/segment_d_xup_inv_0_2/synth/segment_d_xup_inv_0_2.v:57]
WARNING: [Synth 8-4446] all outputs are unconnected for this instance and logic may be removed [c:/Users/stefa/iCloudDrive/ASU/Spring 2020/CSE_320/Labs_New/CSE320_Lab2/CSE320_Lab2.srcs/sources_1/bd/display_decoder/ipshared/4437/src/segment_d.v:66]
INFO: [Synth 8-6157] synthesizing module 'segment_d_xup_inv_0_3' [c:/Users/stefa/iCloudDrive/ASU/Spring 2020/CSE_320/Labs_New/CSE320_Lab2/CSE320_Lab2.srcs/sources_1/bd/display_decoder/ip/display_decoder_segment_d_0_0/src/segment_d_xup_inv_0_3/synth/segment_d_xup_inv_0_3.v:57]
INFO: [Synth 8-6155] done synthesizing module 'segment_d_xup_inv_0_3' (9#1) [c:/Users/stefa/iCloudDrive/ASU/Spring 2020/CSE_320/Labs_New/CSE320_Lab2/CSE320_Lab2.srcs/sources_1/bd/display_decoder/ip/display_decoder_segment_d_0_0/src/segment_d_xup_inv_0_3/synth/segment_d_xup_inv_0_3.v:57]
WARNING: [Synth 8-7023] instance 'xup_inv_3' of module 'segment_d_xup_inv_0_3' has 2 connections declared, but only 1 given [c:/Users/stefa/iCloudDrive/ASU/Spring 2020/CSE_320/Labs_New/CSE320_Lab2/CSE320_Lab2.srcs/sources_1/bd/display_decoder/ipshared/4437/src/segment_d.v:66]
INFO: [Synth 8-6157] synthesizing module 'segment_d_xup_or3_0_0' [c:/Users/stefa/iCloudDrive/ASU/Spring 2020/CSE_320/Labs_New/CSE320_Lab2/CSE320_Lab2.srcs/sources_1/bd/display_decoder/ip/display_decoder_segment_d_0_0/src/segment_d_xup_or3_0_0/synth/segment_d_xup_or3_0_0.v:57]
INFO: [Synth 8-6157] synthesizing module 'xup_or3' [c:/Users/stefa/iCloudDrive/ASU/Spring 2020/CSE_320/Labs_New/CSE320_Lab2/CSE320_Lab2.srcs/sources_1/bd/display_decoder/ip/display_decoder_segment_d_0_0/ipshared/ded9/xup_or3.srcs/sources_1/new/xup_or3.v:5]
	Parameter DELAY bound to: 3 - type: integer 
INFO: [Synth 8-6155] done synthesizing module 'xup_or3' (10#1) [c:/Users/stefa/iCloudDrive/ASU/Spring 2020/CSE_320/Labs_New/CSE320_Lab2/CSE320_Lab2.srcs/sources_1/bd/display_decoder/ip/display_decoder_segment_d_0_0/ipshared/ded9/xup_or3.srcs/sources_1/new/xup_or3.v:5]
INFO: [Synth 8-6155] done synthesizing module 'segment_d_xup_or3_0_0' (11#1) [c:/Users/stefa/iCloudDrive/ASU/Spring 2020/CSE_320/Labs_New/CSE320_Lab2/CSE320_Lab2.srcs/sources_1/bd/display_decoder/ip/display_decoder_segment_d_0_0/src/segment_d_xup_or3_0_0/synth/segment_d_xup_or3_0_0.v:57]
INFO: [Synth 8-6155] done synthesizing module 'segment_d' (12#1) [c:/Users/stefa/iCloudDrive/ASU/Spring 2020/CSE_320/Labs_New/CSE320_Lab2/CSE320_Lab2.srcs/sources_1/bd/display_decoder/ipshared/4437/src/segment_d.v:13]
INFO: [Synth 8-6155] done synthesizing module 'display_decoder_segment_d_0_0' (13#1) [c:/Users/stefa/iCloudDrive/ASU/Spring 2020/CSE_320/Labs_New/CSE320_Lab2/CSE320_Lab2.srcs/sources_1/bd/display_decoder/ip/display_decoder_segment_d_0_0/synth/display_decoder_segment_d_0_0.v:58]
---------------------------------------------------------------------------------
Finished RTL Elaboration : Time (s): cpu = 00:00:05 ; elapsed = 00:00:05 . Memory (MB): peak = 1050.863 ; gain = 307.570
---------------------------------------------------------------------------------

Report Check Netlist: 
+------+------------------+-------+---------+-------+------------------+
|      |Item              |Errors |Warnings |Status |Description       |
+------+------------------+-------+---------+-------+------------------+
|1     |multi_driven_nets |      0|        0|Passed |Multi driven nets |
+------+------------------+-------+---------+-------+------------------+
---------------------------------------------------------------------------------
Start Handling Custom Attributes
---------------------------------------------------------------------------------
---------------------------------------------------------------------------------
Finished Handling Custom Attributes : Time (s): cpu = 00:00:05 ; elapsed = 00:00:05 . Memory (MB): peak = 1050.863 ; gain = 307.570
---------------------------------------------------------------------------------
---------------------------------------------------------------------------------
Finished RTL Optimization Phase 1 : Time (s): cpu = 00:00:05 ; elapsed = 00:00:05 . Memory (MB): peak = 1050.863 ; gain = 307.570
---------------------------------------------------------------------------------
Netlist sorting complete. Time (s): cpu = 00:00:00 ; elapsed = 00:00:00 . Memory (MB): peak = 1050.863 ; gain = 0.000
INFO: [Project 1-570] Preparing netlist for logic optimization

Processing XDC Constraints
Initializing timing engine
Parsing XDC File [c:/Users/stefa/iCloudDrive/ASU/Spring 2020/CSE_320/Labs_New/CSE320_Lab2/CSE320_Lab2.srcs/sources_1/bd/display_decoder/ip/display_decoder_segment_d_0_0/src/segment_d_ooc.xdc] for cell 'inst'
Finished Parsing XDC File [c:/Users/stefa/iCloudDrive/ASU/Spring 2020/CSE_320/Labs_New/CSE320_Lab2/CSE320_Lab2.srcs/sources_1/bd/display_decoder/ip/display_decoder_segment_d_0_0/src/segment_d_ooc.xdc] for cell 'inst'
Parsing XDC File [C:/Users/stefa/iCloudDrive/ASU/Spring 2020/CSE_320/Labs_New/CSE320_Lab2/CSE320_Lab2.runs/display_decoder_segment_d_0_0_synth_1/dont_touch.xdc]
Finished Parsing XDC File [C:/Users/stefa/iCloudDrive/ASU/Spring 2020/CSE_320/Labs_New/CSE320_Lab2/CSE320_Lab2.runs/display_decoder_segment_d_0_0_synth_1/dont_touch.xdc]
Completed Processing XDC Constraints

Netlist sorting complete. Time (s): cpu = 00:00:00 ; elapsed = 00:00:00 . Memory (MB): peak = 1108.660 ; gain = 0.000
INFO: [Project 1-111] Unisim Transformation Summary:
No Unisim elements were transformed.

Constraint Validation Runtime : Time (s): cpu = 00:00:00 ; elapsed = 00:00:00.014 . Memory (MB): peak = 1111.852 ; gain = 3.191
---------------------------------------------------------------------------------
Finished Constraint Validation : Time (s): cpu = 00:00:11 ; elapsed = 00:00:11 . Memory (MB): peak = 1111.852 ; gain = 368.559
---------------------------------------------------------------------------------
---------------------------------------------------------------------------------
Start Loading Part and Timing Information
---------------------------------------------------------------------------------
Loading part: xc7a100tcsg324-1
---------------------------------------------------------------------------------
Finished Loading Part and Timing Information : Time (s): cpu = 00:00:11 ; elapsed = 00:00:11 . Memory (MB): peak = 1111.852 ; gain = 368.559
---------------------------------------------------------------------------------
---------------------------------------------------------------------------------
Start Applying 'set_property' XDC Constraints
---------------------------------------------------------------------------------
Applied set_property DONT_TOUCH = true for inst. (constraint file  {C:/Users/stefa/iCloudDrive/ASU/Spring 2020/CSE_320/Labs_New/CSE320_Lab2/CSE320_Lab2.runs/display_decoder_segment_d_0_0_synth_1/dont_touch.xdc}, line 33).
Applied set_property DONT_TOUCH = true for inst/xup_inv_3. (constraint file  auto generated constraint, line ).
Applied set_property DONT_TOUCH = true for inst/xup_inv_2. (constraint file  auto generated constraint, line ).
Applied set_property DONT_TOUCH = true for inst/xup_inv_1. (constraint file  auto generated constraint, line ).
Applied set_property DONT_TOUCH = true for inst/xup_inv_0. (constraint file  auto generated constraint, line ).
Applied set_property DONT_TOUCH = true for inst/xup_or3_0. (constraint file  auto generated constraint, line ).
Applied set_property DONT_TOUCH = true for inst/xup_and3_2. (constraint file  auto generated constraint, line ).
Applied set_property DONT_TOUCH = true for inst/xup_and3_1. (constraint file  auto generated constraint, line ).
Applied set_property DONT_TOUCH = true for inst/xup_and3_0. (constraint file  auto generated constraint, line ).
---------------------------------------------------------------------------------
Finished applying 'set_property' XDC Constraints : Time (s): cpu = 00:00:11 ; elapsed = 00:00:11 . Memory (MB): peak = 1111.852 ; gain = 368.559
---------------------------------------------------------------------------------
---------------------------------------------------------------------------------
Finished RTL Optimization Phase 2 : Time (s): cpu = 00:00:11 ; elapsed = 00:00:11 . Memory (MB): peak = 1111.852 ; gain = 368.559
---------------------------------------------------------------------------------

Report RTL Partitions: 
+-+--------------+------------+----------+
| |RTL Partition |Replication |Instances |
+-+--------------+------------+----------+
+-+--------------+------------+----------+
---------------------------------------------------------------------------------
Start RTL Component Statistics 
---------------------------------------------------------------------------------
Detailed RTL Component Info : 
---------------------------------------------------------------------------------
Finished RTL Component Statistics 
---------------------------------------------------------------------------------
---------------------------------------------------------------------------------
Start RTL Hierarchical Component Statistics 
---------------------------------------------------------------------------------
Hierarchical RTL Component report 
---------------------------------------------------------------------------------
Finished RTL Hierarchical Component Statistics
---------------------------------------------------------------------------------
---------------------------------------------------------------------------------
Start Part Resource Summary
---------------------------------------------------------------------------------
Part Resources:
DSPs: 240 (col length:80)
BRAMs: 270 (col length: RAMB18 80 RAMB36 40)
---------------------------------------------------------------------------------
Finished Part Resource Summary
---------------------------------------------------------------------------------
---------------------------------------------------------------------------------
Start Cross Boundary and Area Optimization
---------------------------------------------------------------------------------
Warning: Parallel synthesis criteria is not met 
---------------------------------------------------------------------------------
Finished Cross Boundary and Area Optimization : Time (s): cpu = 00:00:13 ; elapsed = 00:00:13 . Memory (MB): peak = 1111.852 ; gain = 368.559
---------------------------------------------------------------------------------

Report RTL Partitions: 
+-+--------------+------------+----------+
| |RTL Partition |Replication |Instances |
+-+--------------+------------+----------+
+-+--------------+------------+----------+
---------------------------------------------------------------------------------
Start Applying XDC Timing Constraints
---------------------------------------------------------------------------------
---------------------------------------------------------------------------------
Finished Applying XDC Timing Constraints : Time (s): cpu = 00:00:20 ; elapsed = 00:00:20 . Memory (MB): peak = 1114.164 ; gain = 370.871
---------------------------------------------------------------------------------
---------------------------------------------------------------------------------
Start Timing Optimization
---------------------------------------------------------------------------------
---------------------------------------------------------------------------------
Finished Timing Optimization : Time (s): cpu = 00:00:20 ; elapsed = 00:00:20 . Memory (MB): peak = 1114.164 ; gain = 370.871
---------------------------------------------------------------------------------

Report RTL Partitions: 
+-+--------------+------------+----------+
| |RTL Partition |Replication |Instances |
+-+--------------+------------+----------+
+-+--------------+------------+----------+
---------------------------------------------------------------------------------
Start Technology Mapping
---------------------------------------------------------------------------------
---------------------------------------------------------------------------------
Finished Technology Mapping : Time (s): cpu = 00:00:20 ; elapsed = 00:00:20 . Memory (MB): peak = 1123.699 ; gain = 380.406
---------------------------------------------------------------------------------

Report RTL Partitions: 
+-+--------------+------------+----------+
| |RTL Partition |Replication |Instances |
+-+--------------+------------+----------+
+-+--------------+------------+----------+
---------------------------------------------------------------------------------
Start IO Insertion
---------------------------------------------------------------------------------
---------------------------------------------------------------------------------
Start Flattening Before IO Insertion
---------------------------------------------------------------------------------
---------------------------------------------------------------------------------
Finished Flattening Before IO Insertion
---------------------------------------------------------------------------------
---------------------------------------------------------------------------------
Start Final Netlist Cleanup
---------------------------------------------------------------------------------
---------------------------------------------------------------------------------
Finished Final Netlist Cleanup
---------------------------------------------------------------------------------
---------------------------------------------------------------------------------
Finished IO Insertion : Time (s): cpu = 00:00:23 ; elapsed = 00:00:24 . Memory (MB): peak = 1139.500 ; gain = 396.207
---------------------------------------------------------------------------------
---------------------------------------------------------------------------------
Start Renaming Generated Instances
---------------------------------------------------------------------------------
---------------------------------------------------------------------------------
Finished Renaming Generated Instances : Time (s): cpu = 00:00:23 ; elapsed = 00:00:24 . Memory (MB): peak = 1139.500 ; gain = 396.207
---------------------------------------------------------------------------------

Report RTL Partitions: 
+-+--------------+------------+----------+
| |RTL Partition |Replication |Instances |
+-+--------------+------------+----------+
+-+--------------+------------+----------+

Report Check Netlist: 
+------+------------------+-------+---------+-------+------------------+
|      |Item              |Errors |Warnings |Status |Description       |
+------+------------------+-------+---------+-------+------------------+
|1     |multi_driven_nets |      0|        0|Passed |Multi driven nets |
+------+------------------+-------+---------+-------+------------------+
---------------------------------------------------------------------------------
Start Rebuilding User Hierarchy
---------------------------------------------------------------------------------
---------------------------------------------------------------------------------
Finished Rebuilding User Hierarchy : Time (s): cpu = 00:00:23 ; elapsed = 00:00:24 . Memory (MB): peak = 1139.500 ; gain = 396.207
---------------------------------------------------------------------------------
---------------------------------------------------------------------------------
Start Renaming Generated Ports
---------------------------------------------------------------------------------
---------------------------------------------------------------------------------
Finished Renaming Generated Ports : Time (s): cpu = 00:00:23 ; elapsed = 00:00:24 . Memory (MB): peak = 1139.500 ; gain = 396.207
---------------------------------------------------------------------------------
---------------------------------------------------------------------------------
Start Handling Custom Attributes
---------------------------------------------------------------------------------
---------------------------------------------------------------------------------
Finished Handling Custom Attributes : Time (s): cpu = 00:00:23 ; elapsed = 00:00:24 . Memory (MB): peak = 1139.500 ; gain = 396.207
---------------------------------------------------------------------------------
---------------------------------------------------------------------------------
Start Renaming Generated Nets
---------------------------------------------------------------------------------
---------------------------------------------------------------------------------
Finished Renaming Generated Nets : Time (s): cpu = 00:00:23 ; elapsed = 00:00:24 . Memory (MB): peak = 1139.500 ; gain = 396.207
---------------------------------------------------------------------------------
---------------------------------------------------------------------------------
Start Writing Synthesis Report
---------------------------------------------------------------------------------

Report BlackBoxes: 
+-+--------------+----------+
| |BlackBox name |Instances |
+-+--------------+----------+
+-+--------------+----------+

Report Cell Usage: 
+------+-----+------+
|      |Cell |Count |
+------+-----+------+
|1     |LUT1 |     4|
|2     |LUT3 |     4|
+------+-----+------+

Report Instance Areas: 
+------+---------------+-----------------------+------+
|      |Instance       |Module                 |Cells |
+------+---------------+-----------------------+------+
|1     |top            |                       |     8|
|2     |  inst         |segment_d              |     8|
|3     |    xup_and3_0 |segment_d_xup_and3_0_0 |     1|
|4     |      inst     |xup_and3_1             |     1|
|5     |    xup_and3_1 |segment_d_xup_and3_0_1 |     1|
|6     |      inst     |xup_and3_0             |     1|
|7     |    xup_and3_2 |segment_d_xup_and3_0_2 |     1|
|8     |      inst     |xup_and3               |     1|
|9     |    xup_inv_0  |segment_d_xup_inv_0_0  |     1|
|10    |    xup_inv_1  |segment_d_xup_inv_0_1  |     1|
|11    |    xup_inv_2  |segment_d_xup_inv_0_2  |     1|
|12    |    xup_inv_3  |segment_d_xup_inv_0_3  |     1|
|13    |    xup_or3_0  |segment_d_xup_or3_0_0  |     1|
|14    |      inst     |xup_or3                |     1|
+------+---------------+-----------------------+------+
---------------------------------------------------------------------------------
Finished Writing Synthesis Report : Time (s): cpu = 00:00:23 ; elapsed = 00:00:24 . Memory (MB): peak = 1139.500 ; gain = 396.207
---------------------------------------------------------------------------------
Synthesis finished with 0 errors, 0 critical warnings and 0 warnings.
Synthesis Optimization Runtime : Time (s): cpu = 00:00:16 ; elapsed = 00:00:22 . Memory (MB): peak = 1139.500 ; gain = 335.219
Synthesis Optimization Complete : Time (s): cpu = 00:00:23 ; elapsed = 00:00:24 . Memory (MB): peak = 1139.500 ; gain = 396.207
INFO: [Project 1-571] Translating synthesized netlist
Netlist sorting complete. Time (s): cpu = 00:00:00 ; elapsed = 00:00:00 . Memory (MB): peak = 1151.559 ; gain = 0.000
INFO: [Project 1-570] Preparing netlist for logic optimization
INFO: [Opt 31-138] Pushed 0 inverter(s) to 0 load pin(s).
Netlist sorting complete. Time (s): cpu = 00:00:00 ; elapsed = 00:00:00 . Memory (MB): peak = 1158.711 ; gain = 0.000
INFO: [Project 1-111] Unisim Transformation Summary:
No Unisim elements were transformed.

INFO: [Common 17-83] Releasing license: Synthesis
38 Infos, 2 Warnings, 0 Critical Warnings and 0 Errors encountered.
synth_design completed successfully
synth_design: Time (s): cpu = 00:00:28 ; elapsed = 00:01:10 . Memory (MB): peak = 1158.711 ; gain = 700.902
Netlist sorting complete. Time (s): cpu = 00:00:00 ; elapsed = 00:00:00 . Memory (MB): peak = 1158.711 ; gain = 0.000
INFO: [Common 17-1381] The checkpoint 'C:/Users/stefa/iCloudDrive/ASU/Spring 2020/CSE_320/Labs_New/CSE320_Lab2/CSE320_Lab2.runs/display_decoder_segment_d_0_0_synth_1/display_decoder_segment_d_0_0.dcp' has been generated.
INFO: [Coretcl 2-1648] Added synthesis output to IP cache for IP display_decoder_segment_d_0_0, cache-ID = 01ef46ec0e9b27e0
INFO: [Coretcl 2-1174] Renamed 13 cell refs.
Netlist sorting complete. Time (s): cpu = 00:00:00 ; elapsed = 00:00:00 . Memory (MB): peak = 1158.711 ; gain = 0.000
INFO: [Common 17-1381] The checkpoint 'C:/Users/stefa/iCloudDrive/ASU/Spring 2020/CSE_320/Labs_New/CSE320_Lab2/CSE320_Lab2.runs/display_decoder_segment_d_0_0_synth_1/display_decoder_segment_d_0_0.dcp' has been generated.
INFO: [runtcl-4] Executing : report_utilization -file display_decoder_segment_d_0_0_utilization_synth.rpt -pb display_decoder_segment_d_0_0_utilization_synth.pb
INFO: [Common 17-206] Exiting Vivado at Fri Feb 14 04:15:25 2020...

*** Running vivado
    with args -log display_decoder_segment_d_0_0.vds -m64 -product Vivado -mode batch -messageDb vivado.pb -notrace -source display_decoder_segment_d_0_0.tcl


****** Vivado v2019.2 (64-bit)
  **** SW Build 2708876 on Wed Nov  6 21:40:23 MST 2019
  **** IP Build 2700528 on Thu Nov  7 00:09:20 MST 2019
    ** Copyright 1986-2019 Xilinx, Inc. All Rights Reserved.

source display_decoder_segment_d_0_0.tcl -notrace
INFO: [IP_Flow 19-234] Refreshing IP repositories
INFO: [IP_Flow 19-1700] Loaded user IP repository 'c:/Users/stefa/iCloudDrive/ASU/Spring 2020/CSE_320/Labs_New/CSE320_Lab2/XUP_LIB'.
INFO: [IP_Flow 19-2313] Loaded Vivado IP repository 'C:/Xilinx/Vivado/2019.2/data/ip'.
INFO: [IP_Flow 19-4838] Using cached IP synthesis design for IP display_decoder_segment_d_0_0, cache-ID = 01ef46ec0e9b27e0.
INFO: [Common 17-206] Exiting Vivado at Fri Feb 14 04:58:45 2020...
